{
  "$schema": "https://json-schema.org/draft/2020-12/schema",
  "title": "Portarium Demo Gallery Index",
  "type": "object",
  "required": [
    "version",
    "generatedAt",
    "generator",
    "clips"
  ],
  "properties": {
    "version": {
      "type": "string"
    },
    "generatedAt": {
      "type": "string",
      "format": "date-time"
    },
    "generator": {
      "type": "string"
    },
    "clips": {
      "type": "array",
      "items": {
        "type": "object",
        "required": [
          "id",
          "title",
          "tags",
          "generatedAt",
          "outputs",
          "frameCount"
        ],
        "properties": {
          "id": {
            "type": "string"
          },
          "title": {
            "type": "string"
          },
          "tags": {
            "type": "array",
            "items": {
              "type": "string"
            }
          },
          "generatedAt": {
            "type": "string",
            "format": "date-time"
          },
          "outputs": {
            "type": "object",
            "properties": {
              "gif": {
                "type": "string"
              },
              "mp4": {
                "type": "string"
              }
            }
          },
          "frameCount": {
            "type": "integer",
            "minimum": 0
          }
        }
      }
    }
  }
}
